<?xml version="1.0" encoding="UTF-8"?>
<!-- tarefa 1 UD7 -->
<garderia xmlns:xsi="http://www.w3.org/2001/XMLSchema-instance"
    xsi:noNamespaceSchemaLocation="tarefa3a.xsd">
    <neno numeroExpedente="2344">
        <nome>Noa Blanco Coello</nome>
        <dataNacemento>2010-10-12</dataNacemento>
        <peso>13.5</peso>
        <altura>78</altura>
        <sexo>F</sexo>
        <vacunas>true</vacunas>
    </neno>
</garderia>